{
    "propertyType": {
        "isDetachedHouse": "X",
        "isSemiDetachedHouse": "X",
        "isTerracedHouse": "X",
        "isBungalow": "X",
        "isFlat": "X",
        "isMaisonette": "X",
        "flatMaisonetteFloor": "10",
        "numberOfFloorsInBlock": "44",
        "isBuiltOrOwnedByLocalAuthority": "Yes",
        "ownerOccupationPercentage": null,
        "isFlatMaisonetteConverted": "X",
        "conversionYear": null,
        "isPurposeBuilt": "X",
        "numberOfUnitsInBlock": "444",
        "isAboveCommercial": "Yes",
        "residentialNatureImpact": "Test Noise",
        "isFreehold": "X",
        "isLeasehold": null,
        "isFlyingFreehold": "Yes",
        "flyingFreeholdPercentage": "1117",
        "maintenanceCharge": 1715,
        "groundRent": 0,
        "roadCharges": 0,
        "remainingLeaseTermYears": "990",
        "isPartCommercialUse": "Yes",
        "commercialUsePercentage": null,
        "isPurchasedUnderSharedOwnership": "Yes",
        "yearPropertyBuilt": "2024"
    },
    "accommodation": {
        "hall": "0",
        "livingRooms": "0",
        "kitchens": "0",
        "hasLift": "Yes",
        "utilityRoom": "0",
        "bedrooms": "0",
        "bathrooms": "0",
        "separateWc": "0",
        "basement": "0",
        "garage": "0",
        "parking": "0",
        "garden": "No",
        "privateGarden": "X",
        "sharedGarden": null,
        "numberOfOutbuildings": "0",
        "outbuildingDetails": "test details",
        "grossFloorAreaOfDwelling": "58"
    },
    "currentOccupancy": {
        "isEverOccupied": "Yes",
        "numberOfAdultsInProperty": "0",
        "isHmoOrMultiUnitFreeholdBlock": "Yes",
        "isCurrentlyTenanted": "Current details",
        "hmoOrMultiUnitDetails": "Yes"
    },
    "newBuild": {
        "isNewBuildOrRecentlyConverted": "Yes",
        "isCompleted": null,
        "isUnderConstruction": "X",
        "isFinalInspectionRequired": "Yes",
        "isNhbcCert": "X",
        "isBuildZone": "X",
        "isPremier": "X",
        "isProfessionalConsultant": "X",
        "isOtherCert": "X",
        "otherCertDetails": "Checkmate / Castle 10",
        "isSelfBuildProject": "Yes",
        "isInvolvesPartExchange": "Yes",
        "isDisclosureOfIncentivesSeen": "Yes",
        "incentivesDetails": "sales incentives are included in the sale and the lenders legal adviser should be",
        "newBuildDeveloperName": "Renaker"
    },
    "reports": {
        "isTimberDamp": "X",
        "isMining": "X",
        "isElectrical": "X",
        "isDrains": "X",
        "isStructuralEngineers": "X",
        "isArboricultural": "X",
        "isMundic": "X",
        "isWallTies": "X",
        "isRoof": "X",
        "isMetalliferous": "X",
        "isSulfateRedAsh": "X",
        "isOtherReport": "X",
        "otherReportDetails": "Test reports"
    },
    "energyEfficiency": {
        "epcScore": "1",
        "epcRating": "Exempt"
    },
    "essentialRepairs": {
        "isEssentialRepairsRequired": "Yes",
        "essentialRepairsDetails": null,
        "isReinspectionRequired": "Yes"
    },
    "localityAndDemand": {
        "isUrban": "X",
        "isSuburban": "X",
        "isRural": "X",
        "isGoodMarketAppeal": "X",
        "isAverageMarketAppeal": "X",
        "isPoorMarketAppeal": "X",
        "isOwnerResidential": "X",
        "isResidentialLet": null,
        "isCommercial": "X",
        "isPricesRising": "X",
        "isPricesStatic": "X",
        "isPricesFalling": "X",
        "isDemandRising": "X",
        "isDemandStatic": "X",
        "isDemandFalling": "X",
        "isAffectedByCompulsoryPurchase": "Yes",
        "compulsoryPurchaseDetails": "Test Case",
        "isVacantOrBoardedPropertiesNearby": "Yes",
        "vacantOrBoardedDetails": "Test case",
        "isOccupancyRestrictionPossible": "Yes",
        "occupancyRestrictionDetails": "Test case",
        "isCloseToHighVoltageEquipment": "Yes",
        "highVoltageEquipmentDetails": "Test case"
    },
    "services": {
        "isMainsWater": "X",
        "isPrivateWater": "X",
        "isUnknownWater": "X",
        "isGasSupply": "No",
        "isElectricitySupply": "Yes",
        "isCentralHeating": "Yes",
        "centralHeatingType": "Electric",
        "isMainDrainage": "X",
        "isSepticTankPlant": "X",
        "isUnknownDrainage": "X",
        "isSolarPanels": "No",
        "isSharedAccess": "Yes",
        "isRoadAdopted": "Yes",
        "isHasEasementsOrRightsOfWay": "No",
        "easementsOrRightsDetails": "Shared pedestrian access",
        "servicesSeparateForFlats": "Yes",
        "servicesSeparateDetails": "your text"
    },
    "construction": {
        "isStandardConstruction": "Yes",
        "nonStandardConstructionType": "Concrete frame with cladding",
        "mainWalls": "Glazed cladding",
        "mainRoof": "Not visible",
        "garageConstruction": "test garage",
        "outbuildingsConstruction": "test outbuildings",
        "isHasAlterationsOrExtensions": "Yes",
        "isAlterationsRequireConsents": "Yes",
        "alterationsAge": "117"
    },
    "conditionOfProperty": {
        "isStructuralMovement": "Yes",
        "isStructuralMovementHistoricOrNonProgressive": "Yes",
        "isStructuralModifications": "Yes",
        "communalAreasMaintained": "Yes",
        "flooding": "X",
        "subsidence": "X",
        "heave": "X",
        "landslip": "X",
        "isPlotBoundariesDefinedUnderPointFourHectares": "Yes",
        "isTreesWithinInfluencingDistance": "Yes",
        "isBuiltOnSteepSlope": "Yes"
    },
    "rentalInformation": null,
    "valuationForFinancePurposesBTL": null,
    "valuationForFinancePurposesHPP": {
        "isSuitableForFinance": "Yes",
        "marketValuePresentCondition": "0",
        "marketValueAfterRepairs": "239120",
        "purchasePriceOrBorrowerEstimate": "239120",
        "buildingInsuranceReinstatementCost": "150000",
        "isInsurancePremiumLoadingRisk": "Yes"
    },
    "applicationType": "HPP",
    "generalRemark": {
        "generalRemark": "Concrete frame with cladding construction. This is considered suitable security for mortgage purposes. There was loft access. This is a new build property without an EPC. Our valuation is provided on the assumption that the property will have an EPC of E or better upon completion. Confirmation should be provided that the cladding system / balconies fully complies with Building (Amendment) Regulations SI 2018/1230 prior to lending. If this is not the case the situation must be referred to the valuer as our valuation may be affected. The property is not lettable in its present condition as it is an incomplete new build. Our 'after works' rental valuation is provided on the basis of the completed property."
    },
    "valuersDeclaration": {
        "valuerSignature": "Address of Valuer",
        "valuerName": "D Sullivan Valuation Management Centre, Cumbria Hous",
        "onBehalfOf": "Connells Survey & Valuation Ltd Leighton Buzzard",
        "telephone": 1525218647,
        "fax": 1525218632,
        "email": "customercare@connells.co.uk",
        "valuerQualifications": {
            "mrics": false,
            "frics": false,
            "assocRics": true
        },
        "ricsNumber": 6777456,
        "valuerAddress": null,
        "valuerPostcode": "LU7 1GN",
        "reportDate": "27/11/2024"
    },
    "valuationReportDetails": {
        "applicationId": null,
        "applicationNumber": "10295615-4750",
        "applicantName": "varun yasa",
        "propertyAddress": "Apartment 1005 12 Bankside Boulevard Salford",
        "postCode": "M3 7HE"
    },
    "rawText": "BUY TO LET MORTGAGE VALUATION REPORT\n\nApplicant(s) Surname(s) & Initials: Application Number: 10295615-4750\nvarun yasa Date of Inspection: 27/11/2024\nProperty Address:\nApartment 1005 12 Bankside Boulevard\nSalford\nPostcode: M3 7HE\n\nPROPERTY TYPE ACCOMMODATION - State Number\nDetached House X Semi-Detached House X X\nTerraced House Hall 0 Living Rooms 0 Kitchen 0 Lift Yes\nBungalow X Flat X\nMaisonette X Utility 0 Bedrooms 0 Bathrooms 0 Separate WC 0\nIf flat / maisonette on what floor? 10 No. of floors in block 44 Basement 0 Garage 0 Parking 0\nProperty built or owned by the Local Authority? Yes X No Gardens No If Yes Private X Communal\nIf Yes, what is the approximate % of owner occupation Yes own Number of outbuildings 0\nIs flat / maisonette: (please provide details)\nIf Converted,\nConverted X please state year of conversion test test details\nPurpose Built X No of units in block 444 Gross floor area of dwelling 58 m2\n\nAbove commercial Yes X No CURRENT OCCUPANCY\nIf Yes, please state if this would affect the residential nature of the Has the property ever been occupied? Yes X No\nproperty e.g. Noise, Odour\nHow many adults appear to live in the property? 0\nTest Noise\nDoes the property appear to be an HMO/Multi Unit\nFreehold Block? Yes X No\nIf Yes, please provide details\nTenure: Freehold X Leasehold Current details\nFlying freehold Yes X No If Yes, what % 1117 Does the property appear to\nMaintenance Road Ground be tenanted at present? Yes X No\nCharge 1715 Charges 0 Rent 0\nCONSTRUCTION\nRemaining term of Lease (if unknown as per RICS red book) 990 Years\nIs the property of standard construction: Yes X No\nIs any part of the property in commercial use? Yes X No\nIf non-standard construction specify name of system or type:\nIf Yes please state % in commercial use yes Concrete frame with cladding\nIs the property being purchased External finish:\nunder a shared ownership scheme? Yes X No\nYear property built 2024 Main Walls: Glazed cladding\nMain Roof: Not visible\nNEW BUILD or < 10 YEARS OLD\nGarage: test garage\nIs the Property New Build or Recently Converted? Yes X No\nOutbuildings: test outbuildings\nIf New Build: Completed Under Construction X Are there any alterations or extensions? Yes X No\nIs Final Inspection Required? Yes x No\nDid the alterations require Building Regs\nIs there a: or Planning Consents? Yes X No\nNHBC Cert X Build Zone X Premier X Professional Consultant X Age of any alterations or extensions? 117 Years\nOther X\nIf Other, please provide details\nCheckmate / Castle 10\nIs this a Self-build project? Yes X No\nDoes this transaction involve an element of\npart exchange? Yes X No\nHas a Disclosure of Incentives form been seen? Yes X No\nIf Yes, please provide details\nIncluding total value of incentives & if part exchange\nNo sales incentives are included in the sale\nand the lenders legal adviser should be\nIf property is New Build, please provide the name of Developer:\nRenaker\n\nGatehouse Bank plc is authorised by the Prudential Regulation Authority and regulated by the Financial Conduct Authority and the Prudential Regulation Lender's Copy\nAuthority and is incorporated in England and Wales (registered number 06260053) with its registered office at 14 Grosvenor Street, London, W1K 4PS. Page 1\nApplication Number: 10295615-4750\nLOCALITY & DEMAND CONDITION OF PROPERTY\nIs location: Urban x Suburban x Rural x Is there any evidence of past or ongoing structural\nx X\nMarket Appeal: Good Average x Poor x movement to the property? Yes No\n\nAre surrounding properties:\nIf Yes, is this historic or non progressive? Yes X No\nIf No, please provide details\nOwner\nx Residential x Commercial x\nResidential Let\nDetails\nAre property prices in the area:\nRising X Static X Falling X Have any structural modifications been effected to\nthe original building of which we as lenders should\nIs demand for this type of property: be aware? Yes X No\nRising X Static X Falling X If Yes, please provide details\nIs the property likely to be affected by\nyour text\ncompulsory purchase or clearance? Yes X No\nIf Yes, please provide details If internal or external communal areas exist have they\nTest Case been maintained to a satisfactory standard Yes X No\nIs there any evidence of or is the property prone to:\nAre there any vacant or boarded up Flooding X Subsidence X Heave X Landslip X\nproperties in close proximity? Yes X No\nPlease provide details:\nIf Yes, please provide details\nTest case your text\nAre the plot boundaries well defined and the total\nIs there a possibility of occupancy restriction? Yes X No below 0.4 hectares? (1 acre) Yes X No\nIf Yes, please provide details Are there any trees within influencing distance\nof the property? Yes X No\nTest case If Yes, please provide details\n\nIs the property close to any high voltage your text\nelectrical supply equipment? Yes X No\nIf Yes, please provide details\nIs the property built on a steeply sloping site? Yes X No\nTest case If Yes, please provide details\nSERVICES your text\nWater: Mains X Private X Unknown X\nGas No Electricity Yes\nREPORTS\nCentral Heating Yes Are any of the following reports required due to major concerns?\n\nIf Yes, please state the type of central heating Timber/Damp X Mining X Electrical X\nElectric Drains X Structural Engineers X Arboricultural X\nMains drainage X Septic tank/Cesspit/Treatment Plant X Mundic X Wall Ties X Roof X\nUnknown X Metalliferous X Sulfate (Red ash) X Other + X\nSolar panels No Shared access Yes Road Adopted Yes If Other, please provide details\nAny easements or rights of way Yes No X Test reports\nIf Yes, please provide details\nShared pedestrian access ESSENTIAL REPAIRS\nAre there any essential repairs required? Yes X No\nIf house split in to flats, are services separate for each unit? If Yes, please provide details\nYes X No N/A\nYES\nIf No, please provide details\nyour text\n\nENERGY EFFICIENCY\nEPC Rating: A B C D\nE F G Exempt X None\nIs re-inspection required? Yes X No\nEPC Score 1\nGatehouse Bank plc is authorised by the Prudential Regulation Authority and regulated by the Financial Conduct Authority and the Prudential Regulation Lender's Copy\nAuthority and is incorporated in England and Wales (registered number 06260053) with its registered office at 14 Grosvenor Street, London, W1K 4PS. Page 2\nApplication Number: 10295615-4750\nRENTAL INFORMATION VALUATION FOR FINANCE PURPOSES\nValuation to be provided on a comparative basis only\nIs there rental demand for a property of this type\nin the locality? Yes X No Is the property suitable security for finance purposes? Yes X No\nIf No, please provide details If No, please provide details\nTest details section Test details section\nMonthly market rent sustainable assuming\nlet on a 6/12 month AST basis, with the 0 Market Value in present condition 0\nproperty in its present condition? Market Value after essential repairs/completion 239120\nMonthly market rent sustainable assuming Purchase Price/\nlet on a 6/12 month AST basis, with the\n1350 Borrowers Estimated Value 239120\nproperty in an improved condition and\nafter any essential repairs? Building Insurance Reinstatement Cost 150000\nAny other matters which may have an impact Is there anything in the valuer's opinion likely\nX to cause a loading to the building insurance\nX\non the ongoing demand for residential letting Yes No\nrelating to this security? premium? Yes No\n\nIf Yes, please provide details If Yes, please provide details\n\nTest details section Test details section\n\nIs the demand for this property only\non an investor to investor basis? Yes X No\nIf Yes, please provide details\nTest details section\n\nGENERAL REMARKS:\nAny other information which in your opinion Gatehouse Bank plc should note:\nIt is assumed that appropriate rights of way and management arrangements are in existence for the\nshared pedestrian access. Legal advisors to confirm.\nConcrete frame with cladding construction. This is considered suitable security for mortgage\npurposes.\nThere was no loft access.\nThis is a new build property without an EPC. Our valuation is provided on the assumption that the\nproperty will have an EPC of E or better upon completion.\nConfirmation should be provided that the cladding system / balconies fully complies with Building\n(Amendment) Regulations SI 2018/1230 prior to lending. If this is not the case the situation must\nbe referred to the valuer as our valuation may be affected.\nThe property is not lettable in its present condition as it is an incomplete new build. Our 'after\nworks' rental valuation is provided on the basis of the completed property.\n\nIMPORTANT NOTICE TO THE APPLICANT:\n1. The Valuer has made this Report without any liability to you. Gatehouse Bank plc, its Agents and the Valuer are not responsible to you for the\naccuracy of opinions in this Report that relate to the value or the condition of the property.\n\n2. No responsibility to any third party is accepted by Gatehouse Bank plc or the valuer in relation to this report.\n\nGatehouse Bank plc is authorised by the Prudential Regulation Authority and regulated by the Financial Conduct Authority and the Prudential Regulation Lender's Copy\nAuthority and is incorporated in England and Wales (registered number 06260053) with its registered office at 14 Grosvenor Street, London, W1K 4PS. Page 3\nApplication Number: 10295615-4750\nVALUERS DECLARATION\n1. I certify that the property offered as security has been inspected by me and that the valuation is a fair indication of the current value and\ncondition for mortgage purposes. I certify that I do not have a direct or indirect interest in the sale of the property and that I have complied with\nGatehouse Bank plc Guidelines with my recommendation. This firm holds adequate indemnity insurance.\n\n2. I further understand that Gatehouse Bank plc may raise finance on the security of the mortgage and I am aware that this valuation will\naccordingly be relied upon by Gatehouse Bank plc and its successors in title and persons deriving title through it, including, without prejudice to\nthe generality of the foregoing, any trustee on behalf of any group of persons or companies interested in the mortgage.\n\n3. In particular, I acknowledge a duty of care to Gatehouse Bank plc, its successors and assigns and those deriving title through it together with any\nmortgage administrator acting on behalf of Gatehouse Bank plc.\n\n535036 = 8061\nSignature of Valuer / Electronic Signature Address of Valuer\n\nName of Valuer D Sullivan Valuation Management Centre, Cumbria Hous\nFor and on behalf of Connells Survey & Valuation Ltd Leighton Buzzard\nTelephone (inc. STD code) 01525218647 Postcode LU7 1GN\n\nFax (inc. STD code) 01525218632 Report Date 27/11/2024\n\nE-mail customercare@connells.co.uk\n\nProfessional Qualifications of the Valuer MRICS FRICS AssocRICS X\nRICS Number 6777456\n\n* See Continuation Page *\nGatehouse Bank plc is authorised by the Prudential Regulation Authority and regulated by the Financial Conduct Authority and the Prudential Regulation Lender's Copy\nAuthority and is incorporated in England and Wales (registered number 06260053) with its registered office at 14 Grosvenor Street, London, W1K 4PS. Page 4\nBUY TO LET MORTGAGE VALUATION REPORT - Continuation Page\n\nApplicant(s) Surname(s) & Initials: Application Number: 10295615-4750\nMiss Shao Jun Koh Date of Inspection: 27/11/2024\nProperty Address:\nApartment 1005 12 Bankside Boulevard\nSalford\nPostcode: M3 7HX\n\nHas a Disclosure of Incentives form been seen? If Yes, please provide details (continued)\nrequired to confirm in accordance with the UK\nFinance Handbook.\n* End of Report *\n\nLender's Copy\nPhotosheet (1 of 2)\n\nPhoto of Front Elevation\n\nPhoto of Rear Elevation\n\nPhoto of Bathroom\nPhotosheet (2 of 2)\n\nPhoto of Kitchen\n\nPhoto of Street Scene"
}